turn,title,url,content,date
-7,삼성전자 'ISE 2022'서 마이크로LED '더 월' 등 신제품 공개,https://www.hankyung.com/it/article/202205104770g,"ISE 2022가 개최되는 스페인 바르셀로나의 피라 그라 비아 전시장에서 삼성전자 모델이 상업용 디스플레이 신제품 2022년형 마이크로 LED '더 월'을 선보이고 있다. [사진=삼성전자 제공]  삼성전자가 10~13일(이상 현지시간) 스페인 바르셀로나에서 열리는 유럽 최대 디스플레이 전시회 'ISE(Integrated Systems Europe) 2022'에 참가해 상업용 디스플레이 신제품을 대거 공개한다.삼성전자는 1728㎡(약 522평) 규모의 공간에 상업용 마이크로 LED 디스플레이 '더 월(The Wall)'을 중심으로 전시장을 구성했다. 2022년형 더 월을 공개하는 건 이번이 처음. 기존 대비 약 43%(LED 면적 기준) 이상 조밀해진 초미세 픽셀 피치(0.63mm)와 초저반사 필름을 새롭게 적용해 보다 완벽한 블랙과 계조 표현을 자랑한다고 회사 측은 설명했다.화면을 4개로 분할해 서로 다른 4개의 4K 콘텐츠를 동시에 재생할 수 있는 '멀티뷰(Multi View)' 기능도 있어 여러 개의 고화질 영상을 동시에 필요로 하는 방송국·보안센터·관제센터 등에서 활용하기에도 좋을 것으로 보인다.또 16:9 비율의 55형 캐비닛 단위로 제공할 수 있어, 고객 요구에 따라 32:9 비율로 설치하는 등 다양한 비율과 크기로 조합할 수 있다.삼성전자는 ISE 기간에 더 월 신제품을 본격적으로 알리고 유럽을 시작으로 전 세계에서 사전 판매를 진행해 3분기 내 전 세계에 공식 출시할 예정이다.디자인과 설치 간편성을 대폭 강화한 더 월의 새로운 라인업 '더 월 올인원(The Wall All-in-One)'도 처음으로 선보인다. 더 월 올인원은 16:9 비율의 총 3개 모델(146형 4K·2K, 110형 2K)로 출시되며, 미리 제작된 프레임 키트와 일체형 스크린을 함께 제공해 벽에 걸기만 하면 되는 초간편 일체형 제품이다. 이 제품 역시 ISE 2022 기간에 본격 수주 활동과 함께 전 세계에 판매를 시작한다.                         ISE 2022가 개최되는 스페인 바르셀로나의 피라 그라 비아 전시장에서 삼성전자 모델이 상업용 디스플레이 신제품 2022년형 마이크로 LED '더 월올인월'을 선보이고 있다. [사진=삼성전자 제공]                  이번 전시회에서 삼성전자는 교육 시장에 최적화된 2022년형 '삼성 플립 프로' 신제품도 선보인다. 삼성 플립 프로(모델명: WMB)는 세계 최고 수준 반응속도를 자랑하는 75형·85형 터치 디스플레이로 △휴대폰·탭·노트북 등 50개의 정보기술(IT) 기기를 동시에 무선으로 연결할 수 있는 스마트뷰+(SmartView+) 기능 △최대 20명까지 동시 필기 지원 등 학생과 교사 간에 보다 원활한 소통의 기회를 제공하는 다양한 기능이 대거 탑재된 스마트기기다.하혜승 삼성전자 영상디스플레이사업부 부사장은 ""ISE 2022를 통해 현존 최고의 상업용 디스플레이인 더 월의 진화를 새롭게 선보였다""며 ""앞으로도 고객이 원하는 다양한 상업용 디스플레이 플랫폼 개발과 기술 혁신을 통해 시장 리더십을 강화해나갈 것""이라고 말했다.강경주 한경닷컴 기자 qurasoha@hankyung.com",2022.05.10.
-6,"""TSMC 보고 있나""…바이든 앞 'GAA 3나노' 뽐낸 삼성전자 [강경주의 IT카...",https://www.hankyung.com/it/article/202205201240g,"조 바이든 미국 대통령이 한국을 찾자마자 윤석열 대통령과 함께 삼성전자 평택캠퍼스를 방문했다. 두 정상은 종이 방명록에 메시지를 남기는 관례를 깨고 3나노미터(㎚, 10억분의 1m) 반도체 웨이퍼(Wafer)에 서명을 하는 파격 연출을 선보였다. 미래 경제안보 핵심인 반도체 분야에서 한미 양국이 굳건한 동맹국이라는 점을 강조함과 동시에 삼성전자의 반도체 기술력이 전 세계에 홍보가 됐다는 평가다.삼성전자가 3나노 웨이퍼 내놓은 이유20일 오후 오산 공군기지에 도착한 바이든 대통령은 곧장 삼성전자 평택캠퍼스로 향했다. 현장에서 미리 대기하고 있던 윤 대통령을 만난 바이든 대통령은 이재용 삼성전자 부회장의 안내를 받으며 가동 중인 평택 1라인(P1)과 건설 중인 3라인(P3) 등을 시찰했다.삼성전자는 바이든 대통령에게 곧 양산에 돌입하는 차세대 '게이트올어라운드'(GAA·Gate-All-Around) 기반의 세계 최초 3나노 반도체 시제품을 소개했다. 이 과정에서 두 정상은 종이 대신 3나노 반도체 웨이퍼에 서명을 해 한미 경제 안보 동맹에 방점을 찍었다는 평가가 나오고 있다.                         취임 후 한국을 첫 방문한 조 바이든 미국 대통령이 20일 오후 경기도 평택시 삼성전자 반도체공장을 방문, 윤석열 대통령과 대화하고 있다. 뒤편 맨 오른쪽은 이재용 삼성전자 부회장. 사진=연합뉴스                  두 정상이 서명한 웨이퍼는 전통적 공정이 아닌 GAA 기술로 제작돼 '한미 기술 동맹'이라는 의미를 극대화했다는 평가가 나온다. GAA는 기존 핀펫(FinFET) 기술보다 칩 면적과 소비전력은 줄이면서 성능은 높인 신기술로, 삼성전자가 세계 최초로 도입했다. 때문에 삼성전자가 TSMC보다 파운드리(반도체 위탁생산) 기술력이 뛰어나다는 점이 강조됐을 것으로 보인다.핀펫 공정은 상어 지느러미처럼 생긴 차단기로 전류를 막아 신호를 제어한다. TSMC를 맹추격 중인 삼성전자는 3나노 공정에서부터는 핀펫 대신 트랜지스터의 채널과 게이트가 4면에서 맞닿게 하는 GAA 기술로 승부수를 띄웠다.파운드리 업체 중 10나노 미만의 미세공정 기술력을 갖춘 기업은 삼성전자와 TSMC뿐이다. 3나노에선 GAA를 도입한 삼성전자가 TSMC보다 반 년 정도 앞선 것으로 알려져 있다. TSMC는 3나노 공정에도 기존의 핀펫 기술을 적용했다. TSMC는 2나노부터 GAA를 적용할 예정이다.TSMC는 당초 지난 2월부터 대만에서 3나노 공정 생산라인을 가동해 오는 7월부터는 3나노 기술이 적용된 인텔, 애플 등의 반도체를 양산할 계획이었지만 수율 확보에 어려움을 겪으며 추후 개발 일정에도 차질이 불가피해졌다.                         취임 후 한국을 첫 방문한 조 바이든 미국 대통령이 윤석열 대통령과 20일 오후 경기도 평택시 삼성전자 반도체공장을 방문, 이재용 부회장의 안내를 받으며 공장을 시찰하고 있다. 사진=연합뉴스                  파운드리의 미래로 불리는 초미세공정에서 TSMC와 삼성전자가 서로 다른 기술을 택한 만큼 업계에서는 각사의 수율 확보에 관심을 가지고 있다. 이 같은 상황에서 삼성전자가 바이든 대통령에게 3나노 웨이퍼를 내놓으면서 수율 확보에 있어 기술적 난제를 해결했다는 분석이 나온다. 업계에서는 삼성전자의 GAA 공정이 TSMC와의 기술 격차를 단숨에 좁히는 승부수가 될 것으로 보고 있다.삼성전자는 곧 GAA 기술을 적용한 3나노 1세대 제품 양산을 시작할 예정이다. 특히 이날 방문에는 삼성전자의 주요 고객사인 미국 반도체 기업 퀄컴의 크리스티아누 아몬 최고경영자(CEO)도 동행한 것으로 알려진 만큼 양사의 협력이 한층 강화될 것으로 예상된다.윤 대통령 ""한국 반도체의 심장인 삼성 평택캠퍼스 방문 감사""미국은 반도체 연구개발, 설계, 장비에서 선두주자이지만 생산시설이 부족하다. 이에 한국과 대만 등 세계 반도체 생산을 주도하는 우방국과 함께 안정적인 반도체 공급망을 구축하고 중국의 추격을 견제하려는 구상을 세웠다. 오는 21일 정상회담에서도 반도체 등 첨단기술 협력이 주요 의제로 논의될 전망이다.윤 대통령은 바이든 대통령과 삼성전자 평택캠퍼스에서 첫 대면 후 열린 환영 연설에서 ""바이든 대통령의 삼성전자 반도체 평택캠퍼스 방문을 계기로 한미 관계가 첨단기술과 공급망 협력에 기반한 경제안보 동맹으로 거듭나기를 희망한다""고 말했다.이어 ""반도체는 자율주행차, AI, 로봇 등 모든 첨단 산업의 필수 부품이자 미래 기술 경쟁력을 좌우하는 핵심 요소""라며 ""바이든 대통령의 이번 방문은 반도체가 갖는 경제안보적 의미는 물론, 반도체를 통한 한미 '글로벌 포괄적 전략동맹'의 의미를 되새길 수 있는 좋은 기회가 될 것""이라고 강조했다.                         취임 후 한국을 첫 방문한 조 바이든 미국 대통령이 윤석열 대통령과 20일 오후 경기도 평택시 삼성전자 반도체공장을 방문, 이재용 부회장의 안내를 받으며 공장을 시찰하고 있다. 사진=연합뉴스                  윤 대통령은 ""저는 반도체가 우리 미래를 책임질 국가 안보 자산이라 생각하며 과감한 인센티브와 필요한 지원을 아끼지 않을 계획""이라며 ""바이든 대통령께서도 우리 반도체 기업들의 미국 투자에 대한 각종 인센티브의 제공뿐 아니라 미국의 첨단 소재, 장비, 설계 기업들의 한국 투자에도 큰 관심을 가져주시길 부탁드린다""라고 제안했다.또 윤 대통령은 반도체를 매개로 한 한미 간 협력의 역사를 언급하며 양국 협력의 중요성을 부각했다. 윤 대통령은 ""한미동맹의 오랜 역사처럼 한미 반도체 협력의 역사 또한 깊다""며 ""이 땅 첫 반도체 기업으로 한미합작의 '한국반도체'가 1974년 설립됐고, 미국 마이크론사와의 기술제휴를 통해 미국 오스틴시, 테일러시에 첨단 파운드리 공장을 설립하기에 이르렀다""고 했다.그러면서 ""미국의 반도체 소재장비 업체들도 한국 투자를 통해 한국 반도체 업체와의 협업을 강화하고 있고 동시에 정부 간 반도체 협력도 활발히 진행되고 있다""며 ""바이든 대통령께서 한국 반도체 심장인 삼성전자 평택 캠퍼스에 방문해 주셔서 깊이 감사드린다""고 덧붙였다.바이든 대통령 ""삼성 같은 기업은 우리의 힘""                      바이든 대통령은 삼성전자 공장을 둘러본 후 연설에서 ""우리의 가치를 공유하지 않는 국가에 의존하지 않는 것이 대단히 중요하다는 것을 알게 됐다""며 ""그러기 위해 중요한 건 우리와 가치를 공유하는 국가와 긴밀하게 협력하는 것, 그게 바로 대한민국 같은 국가다""라고 화답했다.이어 ""이제 우리는 공급망을 회복하고 동맹을 더욱 강화해야 한다. 그게 우리의 전략""이라며 ""그래서 아시아 국가 중 가장 처음으로 한국을 방문하게 된 것""이라고 의미를 부여했다. 아울러 ""한국 같은 민주국가는 삼성 같은 인재를 키워내고, 기술 혁신의 책임 있는 발전을 이끄는 삼성과 같은 기업들은 우리의 힘이 될 것""이라고 말했다.바이든 대통령은 ""우리는 사업 관계를 더 돈독히 하고 더 화합해야 할 것이다. 저와 윤석열 대통령은 앞으로 몇 달간 이를 위한 노력을 이어갈 것""이라며 ""한미동맹은 역내 번영의, 전 세계의 중심축""이라고 강조했다. 끝으로 ""오늘 삼성 방문은 아주 특별한 일정이다. 양국이 구축할 경제 협력을 상징한다""라고 평가했다.업계 관계자는 ""바이든 대통령의 첫 아시아 순방지, 첫 방문 장소로 삼성전자 평택캠퍼스가 낙점되면서 삼성전자의 반도체 기술력이 자연스레 세계에 홍보가 됐다""고 말했다.                         이재용 삼성전자 부회장이 20일 오후 경기도 평택시 삼성전자 반도체 공장을 방문한 윤석열 대통령과 조 바이든 미국 대통령을 환영하는 인사말을 위해 단상에 오르고 있다. 사진=연합뉴스                  강경주 한경닷컴 기자 qurasoha@hankyung.com",2022.05.21.
-6,"""더워지네"" 비스포크 무풍에어컨 '불티'…삼성전자 공장 풀가동",https://www.hankyung.com/it/article/202205171040g,"삼성전자 광주사업장에서 직원들이 '비스포크 무풍에어컨 갤러리'를 생산하는 모습 [사진=삼성전자 제공]                  삼성전자는 2022년형 무풍에어컨 인기에 힘입어 광주사업장에 위치한 에어컨 생산라인을 지난 2월부터 풀가동하고 있다고 17일 밝혔다.삼성전자에 따르면 2022년형 비스포크 무풍에어컨 갤러리는 성능과 디자인 뿐만 아니라 친환경 기술도 강화했다. 에너지 효율 1등급을 획득했으며 기존 냉매에 비해 지구온난화지수(GWP)가 낮은 R32를 적용하고 일회용 건전지를 쓰지 않는 솔라셀 리모컨도 탑재했다.이외에도 UV LED로 팬을 99.9% 살균해주는 기능을 추가한 '이지케어 7단계', 대용량 미세 청정이 가능한 '청정 필터 시스템' 등이 적용돼 더 편리하고 쾌적한 실내 환경을 조성할 수 있다.삼성전자 관계자는 ""비스포크 무풍에어컨 갤러리 외에도 천장에 매립해 공간 활용도가 높은 무풍 시스템에어컨도 지속적으로 판매가 증가하고 있다""며 ""프리미엄 제품을 기반으로 국내 에어컨 시장을 주도하겠다""고 밝혔다.강경주 한경닷컴 기자 qurasoha@hankyung.com",2022.05.17.
-6,"[속보] 바이든 ""삼성전자 방문, 방한 일정에 매우 중요했다""",https://www.hankyung.com/international/article/2022052012107,"[속보] 바이든 ""삼성전자 방문, 방한 일정에 매우 중요했다""김수현 한경닷컴 기자 ksoohyun@hankyung.com",2022.05.20.
-5,삼성전자 스마트공장 도입한 중소기업 건우정공…대통령 표창,https://www.hankyung.com/economy/article/202205263212g,"경기도 안산시에 위치한 금형생산기업 건우정공에서 박순황 회장(왼쪽)과 삼성전자 스마트공장지원센터 임선우 프로(오른쪽)가 CNC 가공설비를 살펴보고 있다/사진=삼성                        삼성전자는 중소벤처기업부·중소기업중앙회와 함께 스마트공장 구축을 지원한 금형업체 '건우정공' 박순황 회장이 '대한민국 중소기업인대회' 중소기업 유공자 포상에서 대통령 표창을 받았다고 26일 밝혔다.박 회장은 금형제작 분야 품질·기술 개발을 통해 국가 산업의 기초적 역량을 확충하고 수출에 힘썼다. 이를 통해 박 회장은 국내 금형산업이 수출효자 산업으로 성장하는데 역할을 하고 산업 발전에 기여한 공로를 인정받아 표창을 받았다.박 회장은 ""4차 산업혁명 시대를 맞아 중소기업도 혁신해야 한다고 하지만, 무엇을 어떻게 바꿔야 하는지, 무슨 방법이 있는지를 몰랐다""며 ""삼성전자에게 멘토링을 받으면서 그저 구호에만 그쳤던 '혁신'은 현장에서 실현이 됐고, 앞으로 나아갈 길도 찾았다""고 말했다.삼성전자에서 스마트공장 구축 지원을 담당하는 직원들도 중소기업 경쟁력 강화 기여 활동을 인정받아 국무총리 표창 1명, 중소벤처기업부 장관 표창 4명 등 총 5명이 상을 받았다. 삼성 멘토링 받으며...구호에 그쳤던 혁신을 현실로박 회장은 국내 금형산업 태동기인 1968년에 사업을 시작했다. 경기도 안산에 위치한 '건우정공'은 1990년에 설립됐으며, 플라스틱 사출금형 업체로 생산제품 전량을 해외로 수출하고 있다. 앱손, 콘티넨탈, ABB 등의 글로벌 기업을 거래선을 두고 있다.박 회장은 2019년 삼성전자와 중소기업중앙회가 중소기업 대표들을 대상으로 스마트공장 구축 산업현장 벤치마킹을 위해 마련한 삼성전자 광주캠퍼스 방문 행사에 참여한 것을 계기로 스마트공장과 인연을 맺었다.박 회장은 50년 이상 금형업에 종사한 전문가이지만, 새로운 기술 노하우를 전수받기 위해 삼성전자 스마트공장 구축 지원 사업을 신청했다.삼성전자 스마트공장 구축 전문가들은 지난해 3월부터 5주간 건우정공에 상주하면서 제조 혁신을 건우정공 직원들과 함께 추진했다.우선, 금형업의 핵심 경쟁력인 제작 납기 단축을 위해 ▲설계 표준화 ▲가공 정밀도 향상 ▲수작업 공정 개선을 통해 납기일을 기존 40일에서 20일로 줄였다.차량용 배터리 케이스 금형은 삼성전자의 기술을 전수받아 생산성을 3배 향상 시켰다.삼성전자 자체 냉각 기술을 전수받았고, 시험 사출도 삼성전자 정밀금형개발센터에서 지원을 받았다. 또, 작업 환경 개선을 위해 생산 라인, 작업 동선, 자재 보관 등 35가지 현장 혁신 과제를 설정해 해결해 나갔다.                          경기도 안산시에 위치한 금형생산기업 건우정공에서 박순황 회장(오른쪽)과 삼성전자 스마트공장지원센터 김극 프로(왼쪽)가 CNC 가공설비를 살펴보고 있다/사진=삼성   삼성전자 스마트공장 도입한 중소기업 잇따라 수상삼성전자가 2018년 중소벤처기업부, 중소기업중앙회와 손잡고 본격적으로 중소·중견기업 대상으로 스마트공장 구축 지원을 시작한 이후, 지원을 받은 중소기업들이 잇따라 대한민국 중소기업인 대회에서 유공자 포상을 받으며, 국가 경제에 대한 기여를 인정받고 있다.지난해에는 진단키트업체 '코젠바이오텍'이 산업포장을 받았다. 서울 금천구에 위치한 코젠바이오텍은 2020년 코로나19 급격한 해외 확산으로 PCR(유전자 증폭) 진단키트 수요가 폭증했을 당시 긴급히 삼성전자 스마트공장 구축 지원을 받았다.그 결과, 주당 진단키트 생산성을 70% 이상 향상시켜 수출 물량을 비약적으로 늘렸다. 당시 지원에 참여한 삼성전자 스마트공장 담당자들도 중소벤처기업부 장관 표창을 받았다.삼성전자는 2015년 중소·중견기업 대상 제조 환경 개선 사업인 스마트공장 구축 지원 사업을 시작했다. 2018년부터는 중소벤처기업부, 중소기업중앙회와 함께 삼성전자와 거래 여부와 상관없이 지원이 필요한 모든 중소·중견기업을 대상으로 확대해 운영하고 있다.삼성전자는 제조현장 혁신, 공장운영 시스템, 제조 자동화 등의 분야에서 총 200여명의 사내 전문가를 선발해 각 기업별 상황에 맞게 노하우를 전수하고 있다.삼성전자는 생산성 향상과 현장 혁신 지원뿐만 아니라 ▲국내외 판로개척 ▲전문 인력 양성 교육 ▲애로기술 지원 등을 통해 자생력 확보를 돕고 있다. 또, 지원이 완료된 후에도 스마트365센터 운영을 통해 사후관리를 통해 지속성장할 수 있도록 지원하고 있다.삼성전자는 2015년부터 2021년까지 총 2800여개사의 스마트공장 구축을 지원했다. 스마트공장 지원 사업은 전국 곳곳의 중소기업을 대상으로 실시돼 지역경제 활성화와 일자리 창출에 기여했다고 평가되고 있다.중소기업중앙회가 3월에 발표한 '삼성전자 스마트공장 구축 지원사업' 성과 분석결과에 따르면 스마트공장을 도입한 기업이 도입하지 않은 기업보다 영업이익 37.6%p, 매출액 11.4%p, 종업원수 3.2%p가 더 높다.성과 분석은 2018~2019년 사업에 참여해 중소벤처기업부· 중소기업중앙회·삼성전자로부터 지원 받은 중소기업 824개사와 동일 업종·매출액 구간의 스마트공장 미도입 중소기업 2,553개사의 재무제표 비교를 통해 이뤄졌다. 최수진 한경닷컴 기자 naive@hankyung.com",2022.05.26.
-5,"삼성전자, 1분기 글로벌TV 시장점유율 1위…""QLED 흥행""",https://www.hankyung.com/economy/article/202205247334g,"삼성전자가 올해 1분기 글로벌 TV 시장에서 금액기준으로 점유율 1위를 기록했다. 삼성전자는 지난해까지 16년 연속 TV 시장에서 1위를 수성한 바 있다.24일 글로벌 시장조사업체 옴디아의 발표에 따르면 삼성전자는 글로벌 TV 시장에서 매출액 기준으로 32.9%, 수량기준 22.5%의 점유율을 기록해 1위 자리에 올랐다. 이는 전분기 대비 금액 기준 5.2% 포인트, 수량 기준 4.7% 포인트 증가한 수치다.삼성전자는 'Neo QLED 8K'를 앞세운 QLED 제품이 꾸준하게 성장했고 초대형·프리미엄 제품의 판매 호조로 1위를 유지했다고 설명했다. QLED는 올 1분기 전년 동기 대비 23% 증가한 330만대가 판매됐다. 삼성전자는 이 중 76% 가량을 차지하는 252만대를 판매했으며 이는 지난해 1분기 대비 25% 증가한 수치이다.심성전자는 삼성 QLED가 2017년 이후 만 5년만에 누적 판매 2800만대를 돌파했고, 올 2분기까지 3000만대를 무난하게 돌파할 것으로 전망했다.미니 LED를 적용한 Neo QLED의 판매 비중 또한 크게 증가하고 있는 것으로 나타났다. 이번 분기 삼성 QLED 매출에서 Neo QLED가 차지하는 비중은 약 40%에 달했다고 삼성전자는 설명했다.삼성전자는 75형 이상 초대형 TV 시장에서 금액 기준 40.7%의 점유율을 기록했다. TV 시장 최대 격전지인 북미와 유럽에서는 각각 48.8%와 53.2%의 점유율을 기록해 절반을 차지했다.80형 이상 시장에서는 금액 기준 48.1%의 점유율을 기록했다.2500달러 이상 프리미엄 TV 시장에서도 삼성전자는 금액 기준 절반에 가까운 49.3%의 점유율로 1위를 차지했다. 이는 전년 동기 대비 2.7% 포인트 증가, 전분기 대비 6.9% 포인트 증가한 수치다.삼성전자는 ""올해 불확실성이 높은 사업 환경 속에서도 Neo QLED 8K와 75형 이상 초대형 제품을 중심으로 17년 연속 1위를 향해 순항할 것""이라고 전망했다.최수진 한경닷컴 기자 naive@hankyung.com",2022.05.24.
-5,'반도체 대장株' 삼성전자·SK하이닉스 주가 강세…반도체 업종 투심 개...,https://www.hankyung.com/finance/article/2022052765496,"사진=게티이미지뱅크                  반도체 대장주인 삼성전자와 SK하이닉스 주가가 오르고 있다. 미국 필라델피아 반도체지수가 오르자 투자심리가 개선된 영향으로 보인다.27일 오전 11시20분 현재 유가증권시장에서 삼성전와 SK하이닉스는 전 거래일 보다 각각 700원(1.06%), 3000원(2.91%) 오른 6만6600원과 10만6000원에 거래되고 있다.간밤 미국 증시에서 반도체 기업들의 주가가 오르자 투자 수요가 몰리고 있는 것으로 보인다. 간밤 미국에서 필라델피아 반도체 지수는 3.87% 상승했다. 엔비디아는 전 거래일 대비 5.16% 올랐고, 마이크론 테크놀로지는 4.02% 상승했다.대규모 투자계획 발표도 호재로 작용하고 있다. 최근 삼성전자는 향후 5년간 8만명을 신규 채용하는 등 팹리스, 파운드리 분야에 450조원 규모 투자 계획을 발표했다. SK하이닉스도 5만명을 채용하는 등 5년간 반도체와 베터리, 바이오 분야에 약 247조원 가량을 투자한다는 계획을 내놓은 바 있다.류은혁 한경닷컴 기자 ehryu@hankyung.com",2022.05.27.
