turn,title,url,content,date
12,"삼성전자의 7조 新환경경영…""車 800만대 탄소감축 효과""",https://www.hankyung.com/finance/article/2022091534631,"삼성전자는 2050년까지 탄소 중립을 달성하겠다는 내용의 ‘신환경경영전략’을 15일 발표했다. 한종희 삼성전자 DX부문장(부회장)이 지난 1월 미국 라스베이거스에서 열린 CES 2022에서 ‘미래를 위한 동행’을 주제로 기조연설을 하고 있다.  /삼성전자 제공                   세계 정보기술(IT) 기업 가운데 전력·물 사용량이 가장 많은 삼성전자가 2050년까지 탄소중립을 달성하겠다고 선언했다. 초저전력 반도체와 제품 개발 등 혁신 기술을 통해 기후위기 극복에 동참한다는 전략이다. 삼성전자는 15일 이 같은 내용을 담은 ‘신(新)환경경영전략’을 발표하고, 경영 패러다임을 ‘친환경 경영’으로 전환한다고 밝혔다. 2050년까지 사용 전력을 100% 재생에너지로 전환하는 캠페인인 글로벌 RE100 이니셔티브에도 가입하기로 했다.이를 위해 삼성전자는 2030년까지 공정가스 저감, 폐전자제품 수거 및 재활용, 수자원 보존, 오염물질 최소화 등 환경경영 과제에 7조원 이상을 투자한다. 이는 재생에너지 목표 달성에 필요한 비용을 제외한 수치다.탄소 감축과 재생에너지 사용 등을 위한 구체적인 로드맵도 제시했다. 삼성전자는 우선 스마트폰 TV 냉장고 세탁기 에어컨 PC 모니터 등 7대 전자제품의 대표 모델에 저전력 기술을 적용, 2030년 전력 소비량을 2019년 대비 평균 30% 개선할 계획이다.삼성전자는 반도체 라인 증설로 2030년 사업장의 하루 취수 필요량이 현재의 두 배 이상으로 늘어난다. 하지만 용수 재이용을 최대한 늘려 이를 작년 수준으로 동결하기로 했다. 반도체 초저전력 기술 확보를 통해 2025년 데이터센터와 모바일 기기에서 사용하는 메모리의 전력 소비량을 대폭 절감할 계획이다.삼성전자는 현재 연간 탄소 배출량이 1700여만t(2021년 기준)인 만큼 탄소중립을 달성할 경우 환경에 미치는 영향이 상당할 것으로 예상했다. 자동차 800만 대의 운행을 중단하는 것과 같은 효과를 볼 것이란 분석이다. 한종희 삼성전자 부회장은 “삼성전자는 혁신 기술과 제품을 통해 밸류체인 전반에 걸쳐 친환경 생태계 구축을 가속하는 촉매 역할을 할 것”이라고 강조했다.유럽 최대 연기금인 네덜란드 연금자산운용(APG)은 삼성전자 장기 투자자의 우려를 해소할 수 있을 것이라며 이번 발표를 환영했다.박신영 기자 nyusos@hankyung.com",2022.09.15.
12,"삼성전자, 장중 5만5500원…또 신저가 기록",https://www.hankyung.com/finance/article/2022091642336,"서울 삼성전자 서초사옥. 사진=연합뉴스  삼성전자가 고환율 부담에 외국인이 물량을 거두면서 장중 52주 신저가를 새로 썼다. 16일 오전 9시 34분 현재 삼성전자는 300원(0.54%) 내린 5만5700원에 거래되고 있다. 장중에는 5만5500원을 기록하며 연중 신저가를 경신했다. 지난 8일 종가 기준 5만5600원으로 52주 신저가를 기록한 지 4거래일 만이다. 골드만삭스, 씨티그룹, CLSA 등 외국계 증권사 창구를 통해 매물이 출회되고 있다.삼성전자의 주가는 지난달 초까지만 해도 6만원선에서 등락을 반복했지만 지난 29일 이후 5만전자를 벗어나지 못하고 있다. 신현아 한경닷컴 기자 sha0119@hankyung.com",2022.09.16.
12,"삼성전자, 2050년 '탄소중립' 선언…""혁신기술로 기후위기 극복""",https://www.hankyung.com/it/article/202209151482g,"삼성전자가 15일 '新환경경영전략'을 발표했다. 사진은 지난 1월 삼성전자 DX부문장 한종희 부회장이 미국 라스베이거스에서 ‘미래를 위한 동행’을 주제로 CES 2022 기조연설을 하는 모습. 사진=삼성전자 제공                  삼성전자가 초저전력 반도체·제품 개발 등 혁신기술을 통해 기후위기 극복에 동참, 2050년 탄소중립을 달성하겠다는 청사진을 제시했다. 세계 최대 정보통신기술(ICT) 제조사의 전면적 친환경 경영 선언이란 점에서 이목을 끈다.삼성전자는 이 같은 내용을 담은 '新환경경영전략'을 발표하고 경영 패러다임을 '친환경 경영'으로 전환한다고 15일 밝혔다.반도체부터 스마트폰·TV·가전까지 전자산업의 전 영역에서 제품을 직접 생산하는 삼성전자는 세계에서 가장 많은 전력을 사용하고 있다. 지난해 전기 사용량이 25.8테라와트시(TWh)에 달한다.전력 수요가 큰 만큼 재생에너지 수급이 쉽지 않고, 국내 재생에너지 공급 여건도 불리한 상황이지만 인류가 당면한 과제인 환경위기 해결에 기여하기 위해 탄소중립 '도전'을 시작하는 것이다.삼성전자의 친환경 경영 패러다임 전환은 글로벌 사업 경쟁력 강화를 위해서도 꼭 필요한 요소다. 삼성전자는 공정가스 저감, 폐전자제품 수거 및 재활용, 수자원 보존, 오염물질 최소화 등 환경경영 과제에 2030년까지 총 7조원 이상 투자한다. 이는 재생에너지 목표 달성에 필요한 비용을 제외한 수치다.한종희 삼성전자 부회장은 ""기후위기 극복과 순환경제 구축은 기업, 정부, 시민 모두의 참여가 필요한 우리 시대 최대의 도전""이라며 ""삼성전자는 혁신기술과 제품을 통해 밸류체인 전반에 걸쳐 친환경 생태계 구축을 가속화하는 촉매 역할을 할 것""이라고 강조했다.2050년 목표…세계 최대 ICT 제조사의 탄소중립 '도전'      삼성전자가 15일 '新환경경영전략'을 발표했다. 사진은 지난 2일 독일 베를린에서 열린 IFA에서  ‘Everyday Sustainability’ 전시를 통해 친환경 노력을 소개하는 모습. 사진=삼성전자 제공                  삼성전자는 2050년 직·간접(Scope1·2) 탄소 순배출을 '제로화'하는 탄소중립을 달성할 계획이다. 2030년 디바이스경험(DX) 부문부터 탄소중립을 우선 달성하고 디바이스솔루션(DS)부문을 포함한 전사는 2050년을 기본 목표로 최대한 조기 달성을 추진한다.삼성전자는 지난해 1700여만t의 탄소를 배출했다. 탄소중립을 달성하면 그만큼의 탄소 배출을 감축할 수 있다는 의미다. 소나무 20억 그루가 흡수하는 이산화탄소 양에 달해 자동차 800만대 운행 중단 효과를 보는 셈이다.삼성전자는 사업장에서 발생하는 탄소 직접배출(Scope1)을 줄이기 위해 혁신기술을 적용한 탄소 배출 저감시설에 집중 투자한다.현재 삼성전자가 직접 배출하는 탄소는 주로 반도체 제조공정에서 발생하는 공정가스와 LNG 등 연료 사용에 따른 것이다. 삼성전자는 2030년까지 공정가스 처리효율을 대폭 개선할 신기술을 개발하고 처리시설을 라인에 확충할 계획이다. 또 LNG 보일러 사용을 줄이기 위해 폐열 활용을 확대하고 전기열원 도입 등도 검토한다.삼성전자는 전력사용으로 인해 발생하는 탄소 간접배출(Scope2)을 줄이기 위해 글로벌 이니셔티브 'RE100'에 가입했고, 2050년까지 사용 전력 재생에너지 전환을 추진하기로 했다.삼성전자는 우선 5년 내에 모든 해외사업장에서 재생에너지 목표 달성을 추진한다. 서남아와 베트남은 2022년, 중남미 2025년, 동남아·CIS·아프리카는 2027년까지 각각 재생에너지 목표 달성을 완료한다. 이미 재생에너지 목표를 달성한 미국, 중국, 유럽의 경우 재생에너지 발전사업자와 직접 체결하는 재생에너지공급계약(PPA)을 확대해 나가기로 했다.DX 부문은 국내외 모두 2027년까지 재생에너지 목표 달성을 추진한다.삼성성전자는 반도체 생산라인을 계속 증설하고 있어 전력 사용량이 늘어날 수 밖에 없다. 또 핵심 반도체사업장이 자리잡은 한국은 재생에너지 공급여건이 상대적으로 안 좋아 재생에너지 목표 달성에 현실적으로 어려움이 크다.삼성전자는 이 같은 상황에도 탄소 감축이라는 전 지구적 노력에 동참하기 위해 재생에너지 활용 확대를 추진키로 했다. 단순히 에너지 구매자로서의 기업 역할에 머무르지 않고 동종 업계, 시민사회 등 다양한 이해관계자와 협력을 강화해나갈 계획이다.초저전력 반도체·전력사용 절감 전자제품 개발     삼성전자 서초 사옥. 사진=연합뉴스                  반도체는 초저전력 기술 확보를 통해 2025년 데이터센터와 모바일 기기에서 사용되는 메모리의 전력 소비량을 대폭 절감할 수 있도록 할 계획이다. 반도체의 공정 미세화와 저전력 설계 기술 발전은 각종 정보기술(IT) 제품과 데이터센터 등의 사용전력 절감을 통해 온실가스 감축에 기여할 수 있다. 뿐만 아니라 더 적은 원자재로도 동일 성능의 제품을 개발할 수 있도록 한다.스마트폰, TV, 냉장고, 세탁기, 에어컨, PC, 모니터 등 7대 전자제품의 대표 모델에 저전력 기술을 적용해 2030년 전력소비량을 2019년 동일 성능 모델 대비 평균 30% 개선한다. 또한 고효율 부품(압축기, 열교환기, 반도체)을 적용하고 인공지능(AI) 절약모드 도입 등 제품의 작동 알고리즘을 개선하는 방식으로 에너지를 절감하는 기술을 개발해 이런 목표를 달성할 방침이다.삼성전자는 2027년까지 모든 업무용 차량(1500여대)을 100% 무공해차(전기·수소차)로 전환한다. 아울러 향후 기타 간접배출(Scope3) 중장기 감축 목표를 설정하고 공급망, 자원순환, 물류 등에서 다양한 감축과제를 지속 발굴할 예정이다.협력사를 대상으로 온실가스 감축 목표 수립, 이행 등도 체계적으로 지원한다. 삼성전자는 삼성EHS전략연구소가 준비한 탄소 감축성과 인증체제에 참여해 성과를 정확히 측정하며 외부 전문가가 포함된 '탄소감축 인증 위원회'를 구성해 객관적 점검을 받기로 했다.원료부터 폐기까지…제품 전 생애주기 자원순환 극대화     사진은 삼성전자 화성 사업장 '그린센터'를 통해 정화된 물로 조성한 연못 모습. 사진=삼성전자 제공                  삼성전자는 원료부터 폐기·재활용까지 전자제품의 모든 주기에 걸쳐 자원순환성을 높이는 프로젝트에 돌입한다. 재활용 소재로 전자제품을 만들고 다 쓴 제품을 수거해 자원을 추출한 뒤 다시 이를 제품의 재료로 사용하는 '자원 순환 체제'를 만드는 것이 목표다.삼성전자는 자원순환 극대화를 위해 소재 재활용 기술과 제품 적용을 연구하는 조직인 '순환경제연구소'를 설립했다. 이 연구소는 재활용 소재 개발, 폐기물 자원 추출 연구 등을 통해 궁극적으로 제품의 모든 소재를 재활용 소재로 대체하는 것을 추진하는 조직이다.삼성전자는 제품에 사용되는 플라스틱 부품에 재생레진 적용을 대폭 확대한다. 2030년까지 플라스틱 부품의 50%, 2050년까지 모든 플라스틱 부품에 재생레진 적용을 추진한다. 갤럭시 Z 폴드4에 적용된 폐어망 등 해양 폐기물을 재활용한 플라스틱의 적용 제품도 확대해 나간다.폐배터리의 경우 2030년까지 삼성전자가 수거한 모든 폐배터리에서 광물을 추출해 재활용하는 체제를 구축할 계획이다. 또 글로벌 환경을 위협하는 폐전자제품(e-Waste) 문제를 해결하기 위해 폐제품 수거 체계를 현재 50여 개국에서 2030년 삼성전자가 제품을 판매하고 있는 모든 나라인 180여 개국으로 확대할 예정이다. 이렇게 해서 2009년 이후 2030년까지 누적으로 업계 최대인 1000만t, 2050년 누적 2500만t의 폐전자제품을 수거할 계획이다. 중고 스마트폰을 회수하고 이를 다른 용도로 재사용하는 업사이클링 프로그램도 적극 추진한다.'산업의 쌀' 반도체, 물 다시 쓰고 살려 쓴다…수자원 아낀다     사진은 삼성전자 직원이 화성 사업장 ‘그린센터(폐수처리시설)’에서 정화시킨 물로 조성한 연못에서 손을 적시는 모습. 사진=삼성전자                  삼성전자는 또 사업장의 자원순환성 강화를 위해 수자원 순환 활용 극대화에 나선다. 특히 반도체 국내 사업장에서는 '물 취수량 증가 제로화'를 추진한다. 반도체 라인 증설로 반도체 사업장의 하루 취수 필요량은 2030년 현재의 2배 이상으로 늘어난다. 하지만 삼성전자는 용수 재이용을 최대한 늘려 이를 작년 수준으로 동결하기로 했다. DX 부문도 수처리 시설 고도화로 용수 재이용을 확대하는 한편 2030년까지 글로벌 수자원 발굴 프로젝트와 수질 개선, 하천 복원사업 등을 통해 물을 쓴 만큼 100% 사회에 다시 돌려줄 예정이다.삼성전자 DS 부문은 배출하는 대기와 수질의 오염물질을 최소화한다. 반도체를 생산하는 과정에서 배출되는 대기 및 수질 오염물질을 제거하는 신기술을 적용해 2040년부터는 환경에 미치는 영향이 거의 없는 '자연상태'로 처리해 배출하는 것을 목표로 정했다. 삼성전자는 새로운 처리기술 개발과 적용을 통해 방류수는 하천 상류 수준의 깨끗한 물로, 배출 대기는 국가 목표 수준의 깨끗한 공기로 처리해 배출할 계획이다. 삼성전자는 또 글로벌 환경안전 인증 기관인 UL(Underwriters Laboratories)이 발급하는 폐기물 매립 제로 플래티넘 인증 획득(자원순환율 99.5% 이상)을 2025년 모든 글로벌 사업장으로 확대해 나갈 계획이다.""탄소 잡고 미세먼지 줄인다""…환경난제 해결에 공헌     사진은 평택사업장 내부에 조성된 연못 모습. 사진=삼성전자 제공                  삼성전자는 초격차 기술력과 역량을 결집해 글로벌 환경난제를 해결하는데 공헌해 나갈 계획이다. 특히 탄소 배출 문제를 해결하기 위한 탄소 포집·활용기술, 글로벌 환경의 골칫거리가 되고 있는 미세먼지 문제를 해결하기 위한 저감 기술 개발에 역량을 집중한다.삼성전자는 반도체 산업현장에서 배출되는 탄소를 저장하고 이를 자원으로 재활용하는 탄소 포집·활용 기술을 개발·상용화하기 위해 작년 9월에 종합기술원 내 탄소포집연구소를 반도체 업계 최초로 설립했다. 삼성전자는 탄소포집 기술을 2030년 이후 반도체 제조시설에 적용한 뒤 전사와 협력사까지 확대 적용할 방침이다. 탄소 포집·활용 기술개발이 결실을 맺게 된다면 반도체 업계 공통의 탄소 배출 문제를 원천적으로 해결하고 반도체 산업의 친환경성을 제고할 수 있을 것으로 전망된다.삼성전자는 대기를 오염시키는 미세먼지 저감 기술 개발에도 적극 나서 2030년부터 지역사회에 이를 활용할 계획이다. 삼성전자는 2019년 1월 미세먼지연구소를 설립했으며 미세먼지 감지, 분석, 제거를 위한 다양한 신개념필터와 공기정화시스템 원천 기술 개발에 매진하고 있다.세척해 다시 사용할 수 있고 미세입자와 가스까지 동시에 제거할 수 있는 세라믹촉매필터를 개발하고 이를 협력사, 버스터미널, 어린이집 등 지역사회에 적용할 예정이다.친환경 분야 스타트업 투자·지원…이행 경과도 점검 유망 친환경 기술을 발굴하고 해당 분야의 스타트업을 육성, 지원하기 위한 투자도 진행한다. 기술혁신 커뮤니티와 함께 혁신기술 상용화 및 보급을 지원함으로써 글로벌 환경난제 해결에 협력할 예정이다. 사내외 벤처 육성 프로그램인 C랩에서도 친환경 관련 과제를 적극 발굴해 지원한다.삼성전자는 탄소중립 목표를 포함한 환경전략의 실행력을 담보하기 위해 구체적 과제별 실행 로드맵을 수립, 대표이사가 주관하는 지속가능경영협의회와 사외이사로 이루어진 지속가능경영위원회를 통해 이행 경과를 점검할 예정이다.조아라 한경닷컴 기자 rrang123@hankyung.com",2022.09.15.
13,"""삼성전자 96층에 사람 있어요""…개미들 '비명' [박의명의 불개미 구조...",https://www.hankyung.com/finance/article/202209232550i,"한 금융정보회사 직원이 삼성전자 주가를 체크하고 있다. 사진=허문찬 기자                  주식시장이 급락세를 이어가면서 개미들이 고통의 시간을 보내고 있습니다. 하지만 가장 힘든 것은 삼성전자 펜트하우스에 입주한 96층 개미들입니다. 96층 개미들은 “평생 본전 탈출하지 못하는 것 아니냐”며 노심초사하고 있습니다. 23일 삼성전자는 0.18% 오른 5만4500원에 마감했습니다. 개미들 집중 매수 구간인 8만5000원 대비 35% 떨어졌습니다. 대부분의 개미들이 희망을 붙잡고 있지만 96층 매수자들은 구조대가 오지 못할 수도 있다는 불안감에 사로잡혀 있습니다. 한 삼성전자 주주는 “물을 계속 타고 있지만 밑빠진 한강물에 물을 붓는 느낌”이라고 했습니다.                          사진=박의명 기자                  손실을 복구하는 것은 수익을 내는 것보다 몇 배로 힘듭니다. 삼성전자 주가는 9만6800원 최고점 대비 43% 떨어졌습니다. 하지만 현재 5만4500원인 주가가 9만6300원에 도달하려면 하락폭의 두 배에 달하는 76%가 올라야 합니다. 96층 입주자 대부분은 ‘포모증후군(Fear of Missing Out)’에 빠졌던 개미들입니다. 삼성전자가 10만원을 돌파한다는 소식에 뒤늦게 추격에 나섰습니다. 하지만 주가가 고점에서 급락하면서 손을 쓸수도 없는 상황에 빠졌습니다. 개미들은 억울하다는 입장입니다. 전문가들이 삼성전자가 10만원을 돌파할 것이라고 입을 모아 얘기했기 때문입니다. 실제로 주가가 9만6000원을 찍었던 작년 1월 증권사 대부분 목표주가를 10만원~12만원으로 제시했습니다.                          2021년 1월 당시 증권사들의 삼성전자 목표주가. 사진=와이즈리포트                  개미들의 잘못된 투자 습관이 손실을 자초했다는 지적도 있습니다. 종목을 발굴하려는 노력 없이 1등주라는 이유만으로 삼성전자를 매수했다는 것입니다. 한 자산운용사 대표는 “대표주를 산다고 모두가 돈을 벌면 세상에는 억만장자가 넘쳐날 것”이라고 했습니다. 경기 침체가 본격화하면서 전망은 점점 어두워지고 있습니다. 이민희 BNK투자증권 연구원은 “글로벌 메모리 시장은 5월 고점 대비 50% 급감했는데, 이는 2000년 닷컴 버블 붕괴, 2008년 금융위기 때와 비교해 두 배 이상 빠른 속도”라고 했습니다.                         사진=인터넷 커뮤니티                  비메모리 반도체에서는 TSMC가 독주체제를 굳혀가고 있고, 스마트폰은 중국 업체들에 추격당하고 있습니다. 투자자들은 삼성전자라는 기업 자체에 믿음을 거는 수밖에 없습니다. 위기 때마다 돌파구를 찾으며 기억을 이뤄냈던 저력을 믿는 것입니다.                          삼성전자 월봉 차트. 사진=키움증권                  삼성전자의 장기 차트를 보면 극복 과정을 볼 수 있습니다. 월봉 기준으로 삼성전자는 60월 이동평균선에서 항상 반등에 성공했습니다. 10년 추세선을 보여주는 120월선까지 주가가 하락한 것은 2008년 글로벌 금융위기 때가 유일합니다. 이 때문에 전문가들은 삼성전자의 추가 하락이 제한될 것이라는 전망을 내놓고 있습니다. 다만 경기 침체가 금융위기로 발전한다면 120월선 부근까지 가능성을 열어놔야 한다는 분석도 나옵니다. 120월선은 4만5000원 부근에 형성돼 있습니다. 여의도 증권가 소식과 개미들 이야기를 다룬 <불개미 구조대>는 매주 토요일 연재됩니다. 아래 기자페이지를 구독하면 기사를 놓치지 않고 받아볼 수 있습니다.박의명 기자 uimyung@hankyung.com",2022.09.24.
13,"""삼성전자 또 해냈다""…이재용 점찍은 '5G 사업' 美서 또 '잭팟'",https://www.hankyung.com/it/article/202209228952g,"2주간의 해외 출장을 마친 이재용 삼성전자 부회장이 21일 강서구 서울김포비즈니스항공센터를 통해 귀국해 취재진 질문에 답하고 있다. 사진=연합뉴스                  삼성전자가 신규 성장동력으로 선정한 5세대(5G) 통신장비 사업에서 가시적 성과를 거뒀다. 삼성전자는 미국 최대 케이블 사업자 컴캐스트(Comcast)의 5G 통신장비 공급사로 선정됐다고 22일 밝혔다. 5G 통신장비 분야는 이재용 삼성전자 부회장(사진)이 인공지능(AI)과 바이오, 반도체 중심의 전장부품과 함께 '4대 미래 성장 사업'으로 꼽은 분야다.그간 삼성전자는 꾸준히 글로벌 통신사들과 파트너십을 맺어왔다. 앞서 2020년 미국 이동통신사 버라이즌, 2022년 미국 디시 네트워크, 2021년 영국 보다폰, 2021년 일본 KDDI, 2022년 인도 에어텔 등 글로벌 초대형 이동통신 사업자들과 5G 장비 공급 계약을 체결한 바 있다.이번 공급 계약을 체결한 컴캐스트는 1963년 설립된 미국 1위 케이블 사업자로 가입자들에게 인터넷, 케이블 TV, 집전화, 모바일 등 다양한 서비스를 제공하고 있다. 미국 전역에 가장 넓은 와이파이(Wi-Fi) 커버리지를 보유하고 있다. 2017년 와이파이 핫스팟과 기존 이동통신 사업자의 무선 네트워크 대여(MVNO) 방식을 이용해 이동통신 사업에 진출했다. 특히 2020년 9월 3.5GHz 대역(CBRS) 주파수 경매에서 라이센스 획득에 성공, 5G망 구축에 투자하고 있다.양사는 올 초 미국 현지에서 5G 상용망 구축을 위한 필드 시험을 성공적으로 마쳤다. 2023년부터는 비디오 스트리밍, 멀티미디어 파일 전송, 온라인 게임 등 고품질의 5G 상용 서비스를 제공할 계획이다.삼성전자는 컴캐스트의 미국 내 5G 상용망 구축을 위한 △5G 중대역(3.5GHz~3.7GHz, CBRS) 기지국 △5G 저대역(600MHz) 기지국 △전선 설치형 소형 기지국(Strand Small Cell) 등 다양한 통신 장비를 공급할 예정이다. 이중 '전선 설치형 소형 기지국'은 기지국, 라디오, 안테나 기능을 하나의 폼팩터로 제공하는 통합 솔루션으로, 삼성전자가 자체 개발한 최신 2세대 5G 모뎀칩(5G Modem SoC)을 탑재해 기지국을 소형화·경량화하면서도 데이터 처리 용량을 기존 제품 대비 약 2배로 대폭 개선한 제품이다.이를 통해 케이블 사업자는 기존에 사용 중인 전선 상에 기지국을 쉽게 설치할 수 있어 설치 공간 확보에 대한 부담을 덜 수 있다. 최신 2세대 5G 모뎀칩은 셀(Cell)당 전력소모를 최대 50%까지 절감한다. 외부 환경에 노출된 전선에 설치되는 특성을 감안해 기상 변화 등 외부 요인으로 기지국이 설치 위치를 이탈할 경우 이를 자동 감지해 알려주는 센서가 탑재됐다.전경훈 삼성전자 네트워크사업부장(사장)은 ""컴캐스트 수주는 삼성전자의 앞선 5G 기술력과 혁신에 대한 끊임없는 도전과 노력의 결실""이라며 ""향후 이동통신 기술 발전이 가져올 새로운 미래에 대한 청사진을 제시하고 차세대 통신 비전을 실현하고자 지속 노력하겠다""고 말했다.컴캐스트 사업개발전략담당 톰 나이겔(Tom Nagel) 전무(Senior VP)는 ""컴캐스트는 고객들에게 더 나은 가치를 제공하기 위해 지속적으로 서비스를 강화하고 있다""며 ""혁신적인 5G 리더십과 검증된 이동통신 솔루션을 보유한 삼성전자와의 협력을 통해 고객들에게 한 차원 높은 모바일 경험을 제공하겠다""고 전했다.삼성전자 관계자는 ""이번 수주를 통해 향후 미국 케이블 사업자 대상 5G 이동통신 시장 진입을 위한 교두보를 마련했다""며 ""미국 내 이동통신 장비의 핵심 공급사로서 입지가 더욱 강화됐다""""고 덧붙였다.조아라 한경닷컴 기자 rrang123@hankyung.com",2022.09.22.
